{
  "unit_id": "CU-6136-6.1.03",
  "title": "Assess colonial changes",
  "objective_ids": [
    "OBJ-6136-6.1.03-00",
    "OBJ-6136-6.1.03-01",
    "OBJ-6136-6.1.03-02",
    "OBJ-6136-6.1.03-03",
    "OBJ-6136-6.1.03-04",
    "OBJ-6136-6.1.03-05"
  ],
  "level": "NSSCO",
  "core_status": "core",
  "objective_type": "integrated_subject_lesson",
  "depth_tier": 3,
  "word_budget": {
    "min": 1397,
    "target": 1701,
    "max": 2005
  },
  "blocks": [
    {
      "block_id": "BLK-6136-6.1.03-01",
      "block_type": "plain_explanation",
      "heading": "Assess colonial changes",
      "text": "Colonial arrangements could reshape education, land access, wages, migration and commercial production, with differing effects on women. Evaluate access, workload and control separately. New wage activity can coexist with exclusion from land or training; one opportunity is not proof of overall equality.",
      "claim_ids": [
        "CLM-6136-6.1-03-00-01",
        "CLM-6136-6.1-03-00-02"
      ],
      "context_tags": [
        "original teaching; fictional examples where stated"
      ],
      "assessment_objectives": [
        "B"
      ],
      "claims_seen": {
        "CLM-6136-6.1-03-00-01": 1,
        "CLM-6136-6.1-03-00-02": 1
      },
      "authored_hash": "4552c0c7e1ea03612df4de2d05144ca008eb55563127dd55cf677e0891b46f87"
    },
    {
      "block_id": "BLK-6136-6.1.03-02",
      "block_type": "plain_explanation",
      "heading": "Education access",
      "text": "Exclusion from schooling or training can restrict access to skills and recognised opportunities. Where selection favours men despite comparable ability, women’s productive choices can be narrowed; a later formal admission rule does not automatically remove fees, distance or time barriers.",
      "claim_ids": [
        "CLM-6136-6.1-03-01-01",
        "CLM-6136-6.1-03-01-02"
      ],
      "context_tags": [
        "original teaching; fictional examples where stated"
      ],
      "assessment_objectives": [
        "B"
      ],
      "claims_seen": {
        "CLM-6136-6.1-03-01-01": 1,
        "CLM-6136-6.1-03-01-02": 1
      },
      "authored_hash": "8401aa1c83abd812b7380017005face40ab1d960cb60e0df200de7d0cbb8c47a"
    },
    {
      "block_id": "BLK-6136-6.1.03-03",
      "block_type": "plain_explanation",
      "heading": "Land entitlement",
      "text": "Access to and control over productive land influence what a person can grow and decide. Where women work land but lack secure decision rights, their labour contribution need not give control over investment or returns. Distinguish labour performed from entitlement.",
      "claim_ids": [
        "CLM-6136-6.1-03-02-01",
        "CLM-6136-6.1-03-02-02"
      ],
      "context_tags": [
        "original teaching; fictional examples where stated"
      ],
      "assessment_objectives": [
        "B"
      ],
      "claims_seen": {
        "CLM-6136-6.1-03-02-01": 1,
        "CLM-6136-6.1-03-02-02": 1
      },
      "authored_hash": "f55195c05c701b373b8a737080a77c601371f9bb273a2c406e019d3c21f68979"
    },
    {
      "block_id": "BLK-6136-6.1.03-04",
      "block_type": "plain_explanation",
      "heading": "Wages and labour",
      "text": "Paid employment can provide income while discriminatory selection, pay or conditions limit its gains. Compare access, earnings and workload together. Entering wage work does not remove unpaid responsibilities unless their arrangement changes.",
      "claim_ids": [
        "CLM-6136-6.1-03-03-01",
        "CLM-6136-6.1-03-03-02"
      ],
      "context_tags": [
        "original teaching; fictional examples where stated"
      ],
      "assessment_objectives": [
        "B"
      ],
      "claims_seen": {
        "CLM-6136-6.1-03-03-01": 1,
        "CLM-6136-6.1-03-03-02": 1
      },
      "authored_hash": "276cf8baaed9ee6b54ec270b3587a6dd815e0bfe63a294b079c9c1d0692a9a00"
    },
    {
      "block_id": "BLK-6136-6.1.03-05",
      "block_type": "plain_explanation",
      "heading": "Migratory labour",
      "text": "Labour migration separates work locations and can change household income and task allocation. Remittances may help, but absent workers can leave others with more farming and care. The balance depends on actual transfers, timing and available support.",
      "claim_ids": [
        "CLM-6136-6.1-03-04-01",
        "CLM-6136-6.1-03-04-02"
      ],
      "context_tags": [
        "original teaching; fictional examples where stated"
      ],
      "assessment_objectives": [
        "B"
      ],
      "claims_seen": {
        "CLM-6136-6.1-03-04-01": 1,
        "CLM-6136-6.1-03-04-02": 1
      },
      "authored_hash": "4d5d07f67c899cb281bf9d60b09ec3ee3da912934a800138f96bbba8da1505e1"
    },
    {
      "block_id": "BLK-6136-6.1.03-06",
      "block_type": "plain_explanation",
      "heading": "Commercial farming",
      "text": "Commercial expansion can alter land access, labour demand and what households produce for sale. Women may gain earnings while facing reduced food-growing access or control of proceeds. Assess whose opportunities and resources change rather than assuming a common benefit.",
      "claim_ids": [
        "CLM-6136-6.1-03-05-01",
        "CLM-6136-6.1-03-05-02"
      ],
      "context_tags": [
        "original teaching; fictional examples where stated"
      ],
      "assessment_objectives": [
        "B"
      ],
      "claims_seen": {
        "CLM-6136-6.1-03-05-01": 1,
        "CLM-6136-6.1-03-05-02": 1
      },
      "authored_hash": "a93c00da87bb036f9ebdb440370bb3dc319b43eafd76aa932d0a7b99c0b16278"
    },
    {
      "block_id": "BLK-6136-6.1.03-07",
      "block_type": "worked_application",
      "heading": "Read the practical connection",
      "text": "Explain whether a fictional historical change establishes an overall improvement for women: wage work becomes available, but women lose food-growing access and retain the same unpaid workload. Judge livelihood choice and welfare. The wage opportunity may provide income, but reduced food access and unchanged unpaid burdens can offset it. An overall verdict needs earnings, food costs and workload evidence; wage availability alone does not establish improved choice or welfare.",
      "claim_ids": [
        "CLM-6136-6.1-03-00-01",
        "CLM-6136-6.1-03-00-02",
        "CLM-6136-6.1-03-01-01",
        "CLM-6136-6.1-03-01-02",
        "CLM-6136-6.1-03-02-01",
        "CLM-6136-6.1-03-02-02",
        "CLM-6136-6.1-03-03-01",
        "CLM-6136-6.1-03-03-02",
        "CLM-6136-6.1-03-04-01",
        "CLM-6136-6.1-03-04-02",
        "CLM-6136-6.1-03-05-01",
        "CLM-6136-6.1-03-05-02"
      ],
      "context_tags": [
        "original teaching; fictional examples where stated"
      ],
      "assessment_objectives": [
        "B"
      ],
      "claims_seen": {
        "CLM-6136-6.1-03-00-01": 1,
        "CLM-6136-6.1-03-00-02": 1,
        "CLM-6136-6.1-03-01-01": 1,
        "CLM-6136-6.1-03-01-02": 1,
        "CLM-6136-6.1-03-02-01": 1,
        "CLM-6136-6.1-03-02-02": 1,
        "CLM-6136-6.1-03-03-01": 1,
        "CLM-6136-6.1-03-03-02": 1,
        "CLM-6136-6.1-03-04-01": 1,
        "CLM-6136-6.1-03-04-02": 1,
        "CLM-6136-6.1-03-05-01": 1,
        "CLM-6136-6.1-03-05-02": 1
      },
      "authored_hash": "675a5f156a24f6e191762a80026dcd329ec9c26676fcbbc09783cd2aa00b055e"
    },
    {
      "block_id": "BLK-6136-6.1.03-08",
      "block_type": "cross_link",
      "heading": "Connect the ideas",
      "text": "Connect to Rural Development (5.1) and modern roles (6.2). Separate actual work, access to resources and decision-making influence. Historical mechanisms here are illustrative; no uniform experience or current legal rule is assumed.",
      "claim_ids": [
        "CLM-6136-6.1-03-00-01",
        "CLM-6136-6.1-03-00-02",
        "CLM-6136-6.1-03-01-01",
        "CLM-6136-6.1-03-01-02",
        "CLM-6136-6.1-03-02-01",
        "CLM-6136-6.1-03-02-02",
        "CLM-6136-6.1-03-03-01",
        "CLM-6136-6.1-03-03-02",
        "CLM-6136-6.1-03-04-01",
        "CLM-6136-6.1-03-04-02",
        "CLM-6136-6.1-03-05-01",
        "CLM-6136-6.1-03-05-02"
      ],
      "context_tags": [
        "original teaching; fictional examples where stated"
      ],
      "assessment_objectives": [
        "B"
      ],
      "claims_seen": {
        "CLM-6136-6.1-03-00-01": 1,
        "CLM-6136-6.1-03-00-02": 1,
        "CLM-6136-6.1-03-01-01": 1,
        "CLM-6136-6.1-03-01-02": 1,
        "CLM-6136-6.1-03-02-01": 1,
        "CLM-6136-6.1-03-02-02": 1,
        "CLM-6136-6.1-03-03-01": 1,
        "CLM-6136-6.1-03-03-02": 1,
        "CLM-6136-6.1-03-04-01": 1,
        "CLM-6136-6.1-03-04-02": 1,
        "CLM-6136-6.1-03-05-01": 1,
        "CLM-6136-6.1-03-05-02": 1
      },
      "authored_hash": "38689766a6948a1a1524be7b68a4045f722747f697d4276fed27d0bbeb00eab6"
    }
  ],
  "word_count": 352,
  "qa_status": "review_required",
  "notes": [
    "Approved lower word allocations advisory; no padding of integrated parent/member explanations."
  ]
}
