{
  "unit_id": "CU-6145-3.5.1",
  "title": "Policies — 3.5.1",
  "objective_ids": [
    "OBJ-6145-3.5.1-01",
    "OBJ-6145-3.5.1-02"
  ],
  "level": "NSSCO",
  "core_status": "core",
  "objective_type": "economics_concept",
  "depth_tier": 1,
  "word_budget": {
    "min": 486,
    "target": 593,
    "max": 700
  },
  "blocks": [
    {
      "block_id": "CU-6145-3.5.1-B01",
      "block_type": "plain_explanation",
      "heading": "Perfect competition and the individual firm",
      "text": "Perfect competition is a model with many small buyers and sellers, identical products, relevant information and freedom of entry and exit. The individual seller is too small to set the market price. It is described as a price taker because buyers can obtain the same product from alternative suppliers at the going price. This is a model with demanding assumptions, not a description automatically attached to a market just because several stalls exist. Different product quality, access or information can change the actual conditions.\n\nA price taker still makes decisions. It chooses how much to offer given the market price, its resources and production costs. Taking price as given does not mean receiving revenue regardless of output or having no reason to control costs. If an invented seller of identical standard sacks asks more than the market price while buyers have the stated alternatives and information, customers can switch. Offering a lower price would also need justification because the seller could receive the going price under the model’s assumptions. The analysis concerns the individual seller: the market price can change when total demand or supply changes. Price taking by a small firm does not mean prices are fixed permanently across the whole market.",
      "claim_ids": [
        "CL-6145-3.5-03",
        "CL-6145-3.5-04"
      ],
      "context_tags": [
        "Namibia",
        "original teaching"
      ],
      "assessment_objectives": [
        "A",
        "B",
        "C"
      ],
      "claims_seen": {
        "CL-6145-3.5-03": 1,
        "CL-6145-3.5-04": 1
      },
      "authored_hash": "c9dc2e01b272f51f53432d46bba8a95f88157804831a6c9e9577efa4d76be592"
    },
    {
      "block_id": "CU-6145-3.5.1-B02",
      "block_type": "cross_link",
      "heading": "Monopoly and the demand constraint",
      "text": "A monopoly has a single supplier in a defined market and barriers preventing effective entry. Defining the market matters: being the sole seller at one corner does not establish monopoly if buyers can readily obtain an equivalent service nearby. Barriers might arise from control over an essential resource or the expense of establishing a competing supply system. The relevant issue is the lack of effective entry and rivalry in that market, rather than the business being large or famous.\n\nA monopolist has greater discretion over price, but demand constrains its options. If it chooses a high price, fewer customers may be willing and able to buy. If it wants to sell more, it may need to accept a lower price. It cannot assume an unlimited number of buyers at any price. Costs also matter: revenue from selling output must be considered alongside the resources used. High revenue is not proof of high profit. At this level the key comparison is therefore price taking versus constrained price-setting power, without introducing advanced optimisation rules.\n\nFor an invented sole local equipment-hire service, specialised machinery might allow useful capacity and cost savings, but customers could suffer if weak rivalry permits poor maintenance or high charges. Evaluate the outcome by service, affordability, cost efficiency and the alternatives available. A possible gain from scale is distinct from evidence that consumers receive it. This returns to the parent comparison: market power changes incentives and choices, while neither the label monopoly nor the label competition supplies a complete welfare judgement by itself. A market definition should specify the product and the area in which effective alternatives are available. A seller’s local prominence alone does not establish the absence of competition, while distant nominal alternatives may be difficult for customers to use.",
      "claim_ids": [
        "CL-6145-3.5-05",
        "CL-6145-3.5-06",
        "CL-6145-3.5-02"
      ],
      "context_tags": [
        "Namibia",
        "original teaching"
      ],
      "assessment_objectives": [
        "A",
        "B",
        "C"
      ],
      "claims_seen": {
        "CL-6145-3.5-05": 1,
        "CL-6145-3.5-06": 1,
        "CL-6145-3.5-02": 1
      },
      "authored_hash": "31fd3721557eaf1e009633cb0a5952853ecb4b7a4a0c2cc680bc0f8855acb437"
    }
  ],
  "word_count": 496,
  "qa_status": "review_required"
}
