{
  "unit_id": "CU-6136-10.1.09",
  "title": "Population and sample",
  "objective_ids": [
    "OBJ-6136-10.1.09-00",
    "OBJ-6136-10.1.09-01",
    "OBJ-6136-10.1.09-02"
  ],
  "level": "NSSCO",
  "core_status": "core",
  "objective_type": "integrated_subject_lesson",
  "depth_tier": 3,
  "word_budget": {
    "min": 796,
    "target": 970,
    "max": 1145
  },
  "blocks": [
    {
      "block_id": "BLK-6136-10.1.09-01",
      "block_type": "plain_explanation",
      "heading": "Population and sample",
      "text": "The research population is the whole defined group; a sample is the selected subset studied. The sampling method is the selection procedure, not the group itself. Findings need limits where the frame misses groups or responses are incomplete.",
      "claim_ids": [
        "CLM-6136-10.1-09-00-01",
        "CLM-6136-10.1-09-00-02"
      ],
      "context_tags": [
        "original teaching; fictional examples where stated"
      ],
      "assessment_objectives": [
        "C"
      ],
      "claims_seen": {
        "CLM-6136-10.1-09-00-01": 1,
        "CLM-6136-10.1-09-00-02": 1
      },
      "authored_hash": "14a752aae26dcf953b1891dbc523372172a64f858cf829b5b629fdad2785c8d8"
    },
    {
      "block_id": "BLK-6136-10.1.09-02",
      "block_type": "plain_explanation",
      "heading": "Research population",
      "text": "The research population is the whole group of units or people that the enquiry is intended to investigate. Define it before sampling: all households on the relevant settlement list differs from everyone in Namibia.",
      "claim_ids": [
        "CLM-6136-10.1-09-01-01",
        "CLM-6136-10.1-09-01-02"
      ],
      "context_tags": [
        "original teaching; fictional examples where stated"
      ],
      "assessment_objectives": [
        "C"
      ],
      "claims_seen": {
        "CLM-6136-10.1-09-01-01": 1,
        "CLM-6136-10.1-09-01-02": 1
      },
      "authored_hash": "8644b086210688517ac3035863b75e595825dd5a55c21723cccb6a4b728d4d81"
    },
    {
      "block_id": "BLK-6136-10.1.09-03",
      "block_type": "plain_explanation",
      "heading": "Research sample",
      "text": "The research sample is the selected subset of the research population from which data are collected. A list of 12 selected households describes a sample; choosing every fifth household describes the method.",
      "claim_ids": [
        "CLM-6136-10.1-09-02-01",
        "CLM-6136-10.1-09-02-02"
      ],
      "context_tags": [
        "original teaching; fictional examples where stated"
      ],
      "assessment_objectives": [
        "C"
      ],
      "claims_seen": {
        "CLM-6136-10.1-09-02-01": 1,
        "CLM-6136-10.1-09-02-02": 1
      },
      "authored_hash": "0d05ebd915c9c5930365e660cda41210de37f1b4064d1840b42f8a398f8852cf"
    },
    {
      "block_id": "BLK-6136-10.1.09-04",
      "block_type": "worked_application",
      "heading": "Worked enquiry connection",
      "text": "Suggest a suitable population definition for an invented enquiry into households using one settlement water point during a stated week. Define all households using that point in the settlement and week, with an appropriate way to identify them before selection. National residents are too broad for that question.",
      "claim_ids": [
        "CLM-6136-10.1-09-00-01",
        "CLM-6136-10.1-09-00-02",
        "CLM-6136-10.1-09-01-01",
        "CLM-6136-10.1-09-01-02",
        "CLM-6136-10.1-09-02-01",
        "CLM-6136-10.1-09-02-02"
      ],
      "context_tags": [
        "original teaching; fictional examples where stated"
      ],
      "assessment_objectives": [
        "C"
      ],
      "claims_seen": {
        "CLM-6136-10.1-09-00-01": 1,
        "CLM-6136-10.1-09-00-02": 1,
        "CLM-6136-10.1-09-01-01": 1,
        "CLM-6136-10.1-09-01-02": 1,
        "CLM-6136-10.1-09-02-01": 1,
        "CLM-6136-10.1-09-02-02": 1
      },
      "authored_hash": "bb0617b42d36d12247dd2681d82b844c64ed7b51a7c92968a1c4555ac399c177"
    }
  ],
  "word_count": 162,
  "qa_status": "review_required",
  "notes": [
    "Approved lower word allocations advisory; no padding of integrated parent/member explanations."
  ]
}
