{
 "unit_id": "CU-9609-3.1.7",
 "title": "Customer relationship management",
 "objective_ids": [
  "OBJ-9609-3.1.7-01",
  "OBJ-9609-3.1.7-02"
 ],
 "level": "AS Level",
 "core_status": "core",
 "objective_type": "business_method_strategy",
 "depth_tier": 2,
 "word_budget": {
  "min": 450,
  "target": 800,
  "max": 1300
 },
 "qa_status": "review_required",
 "notes": [
  "Authored 2026-09-12 at Stage 13 under standard v0.2.0-draft. Every objective in topic 3.1 was rated synthesise: the supplied chapter material follows a pre-2023 edition and does not separate AS from A Level, so the substance here is originally authored against the syllabus wording.",
  "Every claim is provenance generated_gap and verification unverified. Publication is blocked until independent semantic review (RS-28) and documented human approval of generated claims (RS-13)."
 ],
 "blocks": [
  {
   "block_id": "3.1.7-b1",
   "block_type": "learner_objective",
   "heading": "What this section covers",
   "text": "Explain the aims of customer relationship management, and evaluate its costs and its benefits to a business.",
   "claim_ids": [],
   "context_tags": [],
   "assessment_objectives": [
    "AO1"
   ],
   "claims_seen": {},
   "authored_hash": "e51166c8af6542bb7b337343ec342760c3dcaa9163aa766c12cb15f11e1a2668"
  },
  {
   "block_id": "3.1.7-b2",
   "block_type": "definition",
   "heading": "What CRM is",
   "text": "Customer relationship management (CRM) is the way a business manages its dealings with the customers it already has - usually supported by a record of who they are and what they have bought - in order to keep them and to increase what they buy.\n\nThe phrase covers two things at once: an approach, which is treating the existing customer as an asset to be kept rather than a sale already banked, and the system that makes the approach practical, which is the record itself. A shopkeeper who remembers a hundred customers is doing CRM without software. A business with twelve thousand customers needs the database to do the same thing.",
   "claim_ids": [
    "CLM-9609-3.1-071"
   ],
   "context_tags": [],
   "assessment_objectives": [
    "AO1"
   ],
   "claims_seen": {
    "CLM-9609-3.1-071": 1
   },
   "authored_hash": "89472c98b1b6605402e9f89731fb4e890a8c380d43059691168129409ec48e60"
  },
  {
   "block_id": "3.1.7-b3",
   "block_type": "components",
   "heading": "What CRM aims at",
   "text": "The aims are to retain existing customers; to increase how often and how much each of them buys; to use what is recorded about them to make offers that fit; to improve the service they receive and the way complaints are handled; and to collect feedback that guides what the business sells next.\n\nRetention comes first because of the arithmetic behind it. Selling again to somebody who has already bought usually costs less in promotion than persuading a stranger to buy for the first time - the business already knows what they bought, and has permission to contact them. Long-standing customers may also recommend the business to others, which brings in sales it did not pay to promote.\n\nThe recorded history is what makes an offer specific rather than general. A service reminder sent when a machine is actually due, or a refill offer timed to when the last one should be running out, is more likely to be acted on than the same message sent to every name on the list.",
   "claim_ids": [
    "CLM-9609-3.1-072",
    "CLM-9609-3.1-073",
    "CLM-9609-3.1-074"
   ],
   "context_tags": [],
   "assessment_objectives": [
    "AO1",
    "AO3"
   ],
   "claims_seen": {
    "CLM-9609-3.1-072": 1,
    "CLM-9609-3.1-073": 1,
    "CLM-9609-3.1-074": 1
   },
   "authored_hash": "8a7971b80e685e84baf676f382d41f2ab0d0055134e458dc19751cec216bd1c3"
  },
  {
   "block_id": "3.1.7-b4",
   "block_type": "limitation",
   "heading": "What CRM costs",
   "text": "The costs are easy to underestimate because only the first of them appears on a quotation.\n\nThe software has to be bought or subscribed to. The customer data has to be entered and cleaned, which on an established business with years of paper records is the largest single task. Staff have to be trained. Then, every day afterwards, staff spend time recording each contact instead of serving the next customer - a cost that never ends and never appears as an invoice. And the personal data has to be kept secure and used within the law.\n\nThat last item is an obligation, not an option. Data has to be kept safe and used for the purpose customers were told about. A business that loses customer data, or uses it in a way its customers did not expect, can lose exactly the trust the system was bought to build, so the security and permission costs belong inside the decision rather than beside it.",
   "claim_ids": [
    "CLM-9609-3.1-075",
    "CLM-9609-3.1-078"
   ],
   "context_tags": [],
   "assessment_objectives": [
    "AO1",
    "AO3"
   ],
   "claims_seen": {
    "CLM-9609-3.1-075": 1,
    "CLM-9609-3.1-078": 1
   },
   "authored_hash": "b5006a5cd183f3d4e3f4cf6753317636d6010f298de24557cb6e19e795cb3f49"
  },
  {
   "block_id": "3.1.7-b5",
   "block_type": "benefit",
   "heading": "What CRM returns",
   "text": "Against those costs sit repeat revenue from customers who stay, lower promotional spending for each sale made to them, better information for segmenting the market and timing offers, faster handling of complaints, and the chance to sell a related product to somebody who has already bought once.\n\nThe second of those is where most of the value usually sits. A business that raises the share of customers who buy again is buying fewer first sales at full promotional cost, and the effect compounds over years rather than showing up in one month's figures.",
   "claim_ids": [
    "CLM-9609-3.1-076"
   ],
   "context_tags": [],
   "assessment_objectives": [
    "AO1",
    "AO3"
   ],
   "claims_seen": {
    "CLM-9609-3.1-076": 1
   },
   "authored_hash": "bfcb3777873e83e291b5341ecfc52006097457fad5e71dd2cc0edc816901785f"
  },
  {
   "block_id": "3.1.7-b6",
   "block_type": "evaluation",
   "heading": "Whether it is worth it",
   "text": "The benefits depend on three conditions that a business can check before it spends.\n\nThe data has to be accurate and kept up to date, because offers built on wrong records annoy the customers they reach. Staff have to use the system rather than work around it, which is a question of training and of whether recording a contact is quick enough to be done while the customer is still there. And the customers have to be in a market where they buy repeatedly.\n\nThat third condition is the one that decides most cases. A vehicle-parts supplier whose garage customers order every week has a great deal to gain from knowing what each of them buys. A firm that fits a borehole pump once and may not hear from that household for fifteen years has much less, and would do better to spend the same money on winning new customers - though even there a record of what was installed has some value when a repair is eventually needed.",
   "claim_ids": [
    "CLM-9609-3.1-077"
   ],
   "context_tags": [],
   "assessment_objectives": [
    "AO3",
    "AO4"
   ],
   "claims_seen": {
    "CLM-9609-3.1-077": 1
   },
   "authored_hash": "dc8462bdc9b816e378e809c71697498a581ab18de04775524bf242a1cbf0d64b"
  }
 ],
 "word_count": 724
}