{
  "unit_id": "CU-6136-10.1.02",
  "title": "A usable topic",
  "objective_ids": [
    "OBJ-6136-10.1.02-00",
    "OBJ-6136-10.1.02-01",
    "OBJ-6136-10.1.02-02",
    "OBJ-6136-10.1.02-03",
    "OBJ-6136-10.1.02-04"
  ],
  "level": "NSSCO",
  "core_status": "core",
  "objective_type": "integrated_subject_lesson",
  "depth_tier": 3,
  "word_budget": {
    "min": 1327,
    "target": 1618,
    "max": 1909
  },
  "blocks": [
    {
      "block_id": "BLK-6136-10.1.02-01",
      "block_type": "plain_explanation",
      "heading": "A usable topic",
      "text": "A good topic combines interest, relevance, ethical practice and a specific area and time. Test whether a manageable enquiry can answer it with available resources. Interest alone does not justify sensitive questions or unsafe fieldwork.",
      "claim_ids": [
        "CLM-6136-10.1-02-00-01",
        "CLM-6136-10.1-02-00-02"
      ],
      "context_tags": [
        "original teaching; fictional examples where stated"
      ],
      "assessment_objectives": [
        "C"
      ],
      "claims_seen": {
        "CLM-6136-10.1-02-00-01": 1,
        "CLM-6136-10.1-02-00-02": 1
      },
      "authored_hash": "dd9adfb21634dcbbf7483b5c27092d779ae80da620f2c6bf65f0c89bf3c95dcc"
    },
    {
      "block_id": "BLK-6136-10.1.02-02",
      "block_type": "plain_explanation",
      "heading": "Interest",
      "text": "Interest gives a researcher a reason to sustain attention to an issue. It should not preselect the answer; record observations that challenge expectations as well as those that agree.",
      "claim_ids": [
        "CLM-6136-10.1-02-01-01",
        "CLM-6136-10.1-02-01-02"
      ],
      "context_tags": [
        "original teaching; fictional examples where stated"
      ],
      "assessment_objectives": [
        "C"
      ],
      "claims_seen": {
        "CLM-6136-10.1-02-01-01": 1,
        "CLM-6136-10.1-02-01-02": 1
      },
      "authored_hash": "bbbff749ee7203ff2ead434cba77207a1d15e306ebc50037a4772c041e9e23c9"
    },
    {
      "block_id": "BLK-6136-10.1.02-03",
      "block_type": "plain_explanation",
      "heading": "Relevance",
      "text": "Relevance links an enquiry to a meaningful development issue and the evidence needed. A water-journey question can inform access, while an unrelated opinion survey may not address that aim.",
      "claim_ids": [
        "CLM-6136-10.1-02-02-01",
        "CLM-6136-10.1-02-02-02"
      ],
      "context_tags": [
        "original teaching; fictional examples where stated"
      ],
      "assessment_objectives": [
        "C"
      ],
      "claims_seen": {
        "CLM-6136-10.1-02-02-01": 1,
        "CLM-6136-10.1-02-02-02": 1
      },
      "authored_hash": "4d29714489b0cac89d31220f492ee199f7c35f278ae2eb76a2a40d94a619cad3"
    },
    {
      "block_id": "BLK-6136-10.1.02-04",
      "block_type": "plain_explanation",
      "heading": "Ethics",
      "text": "Ethical enquiry respects consent, privacy, safety and participants’ choice not to take part. Use non-sensitive topics, explain purpose and avoid identifiable records where unnecessary. Do not pressure participants, enter unsafe sites or ask classmates for health or violence disclosures.",
      "claim_ids": [
        "CLM-6136-10.1-02-03-01",
        "CLM-6136-10.1-02-03-02"
      ],
      "context_tags": [
        "original teaching; fictional examples where stated"
      ],
      "assessment_objectives": [
        "C"
      ],
      "claims_seen": {
        "CLM-6136-10.1-02-03-01": 1,
        "CLM-6136-10.1-02-03-02": 1
      },
      "authored_hash": "ec8c79c5f1b7a51578a203dd4943a4727b1998277594bf4fb3b191491fe8477e"
    },
    {
      "block_id": "BLK-6136-10.1.02-05",
      "block_type": "plain_explanation",
      "heading": "Specific scope",
      "text": "State the study area, population, variables and collection dates or period. A bounded question such as school-route travel time in one settlement during one week is more manageable than asking why education is unequal everywhere.",
      "claim_ids": [
        "CLM-6136-10.1-02-04-01",
        "CLM-6136-10.1-02-04-02"
      ],
      "context_tags": [
        "original teaching; fictional examples where stated"
      ],
      "assessment_objectives": [
        "C"
      ],
      "claims_seen": {
        "CLM-6136-10.1-02-04-01": 1,
        "CLM-6136-10.1-02-04-02": 1
      },
      "authored_hash": "6e628b650a396414f1dc4255fa2fb2699e4a7eb7a2cbe7c5ebe3c37c17f109c7"
    },
    {
      "block_id": "BLK-6136-10.1.02-06",
      "block_type": "worked_application",
      "heading": "Worked enquiry connection",
      "text": "Explain why a topic needs more than personal interest. It also needs safe feasible evidence and a bounded question; interest cannot make an intrusive or unanswerable enquiry suitable.",
      "claim_ids": [
        "CLM-6136-10.1-02-00-01",
        "CLM-6136-10.1-02-00-02",
        "CLM-6136-10.1-02-01-01",
        "CLM-6136-10.1-02-01-02",
        "CLM-6136-10.1-02-02-01",
        "CLM-6136-10.1-02-02-02",
        "CLM-6136-10.1-02-03-01",
        "CLM-6136-10.1-02-03-02",
        "CLM-6136-10.1-02-04-01",
        "CLM-6136-10.1-02-04-02"
      ],
      "context_tags": [
        "original teaching; fictional examples where stated"
      ],
      "assessment_objectives": [
        "C"
      ],
      "claims_seen": {
        "CLM-6136-10.1-02-00-01": 1,
        "CLM-6136-10.1-02-00-02": 1,
        "CLM-6136-10.1-02-01-01": 1,
        "CLM-6136-10.1-02-01-02": 1,
        "CLM-6136-10.1-02-02-01": 1,
        "CLM-6136-10.1-02-02-02": 1,
        "CLM-6136-10.1-02-03-01": 1,
        "CLM-6136-10.1-02-03-02": 1,
        "CLM-6136-10.1-02-04-01": 1,
        "CLM-6136-10.1-02-04-02": 1
      },
      "authored_hash": "aedd16051f411d8f50aa2969e80c78069d80dcf5579376cc3e4b1d39cc4036e1"
    },
    {
      "block_id": "BLK-6136-10.1.02-07",
      "block_type": "cross_link",
      "heading": "Connect the ideas",
      "text": "Connect the enquiry to its actual development topic and to Population (7.1) for denominators. Keep an individual record of the real procedure, changes, findings and limits. Fictional models teach the method and must not be presented as the learner’s completed fieldwork.",
      "claim_ids": [
        "CLM-6136-10.1-02-00-01",
        "CLM-6136-10.1-02-00-02",
        "CLM-6136-10.1-02-01-01",
        "CLM-6136-10.1-02-01-02",
        "CLM-6136-10.1-02-02-01",
        "CLM-6136-10.1-02-02-02",
        "CLM-6136-10.1-02-03-01",
        "CLM-6136-10.1-02-03-02",
        "CLM-6136-10.1-02-04-01",
        "CLM-6136-10.1-02-04-02"
      ],
      "context_tags": [
        "original teaching; fictional examples where stated"
      ],
      "assessment_objectives": [
        "C"
      ],
      "claims_seen": {
        "CLM-6136-10.1-02-00-01": 1,
        "CLM-6136-10.1-02-00-02": 1,
        "CLM-6136-10.1-02-01-01": 1,
        "CLM-6136-10.1-02-01-02": 1,
        "CLM-6136-10.1-02-02-01": 1,
        "CLM-6136-10.1-02-02-02": 1,
        "CLM-6136-10.1-02-03-01": 1,
        "CLM-6136-10.1-02-03-02": 1,
        "CLM-6136-10.1-02-04-01": 1,
        "CLM-6136-10.1-02-04-02": 1
      },
      "authored_hash": "97793bf00cd63b02f58365f51dc76d731d86e8e106d7eff0ce62b4b258435a84"
    }
  ],
  "word_count": 250,
  "qa_status": "review_required",
  "notes": [
    "Approved lower word allocations advisory; no padding of integrated parent/member explanations."
  ]
}
