{
 "unit_id": "CU-8224-4.1.1",
 "title": "Foundations of organic chemistry — 4.1.1",
 "objective_ids": [
  "OBJ-8224-4.1.1-01",
  "OBJ-8224-4.1.1-02"
 ],
 "level": "NSSCAS",
 "core_status": "core",
 "objective_type": "integrated_teaching",
 "depth_tier": 3,
 "word_budget": {
  "min": 572,
  "target": 696,
  "max": 820
 },
 "blocks": [
  {
   "block_id": "4.1-1-01-b1",
   "block_type": "plain_explanation",
   "heading": "Terms describe particles, electron movement and overall change",
   "text": "A functional group is an atom or group of atoms responsible for characteristic chemical behaviour, such as C=C in an alkene or –OH in an alcohol. A free radical contains an unpaired electron, shown by a dot. Homolytic fission splits a covalent bond with one electron going to each fragment; heterolytic fission sends both electrons to one fragment. Draw single-electron fishhook arrows for homolysis and a full-headed curved arrow for an electron pair in heterolysis.\n\nA nucleophile is an electron-pair donor and an electrophile an electron-pair acceptor. A nucleophile can be neutral or negative; a lone pair or a multiple bond can supply its reactive pair. An electrophile can be positive or a suitable electron-deficient centre in a neutral molecule. Start a pair arrow at the electron source, not at a positive charge, and end it where the pair goes.\n\nInitiation creates radicals, for example Cl2 splitting under suitable light. Propagation consumes a radical and makes another: Cl• + CH4 → HCl + CH3•, followed by CH3• + Cl2 → CH3Cl + Cl•. The methyl radical is an intermediate and chlorine radical is regenerated. Termination combines radicals without making another radical. These terms explain a chain, rather than three alternative names for its overall equation.\n\nAddition joins species across a multiple bond without eliminating a small molecule. Substitution replaces one atom or group by another. Elimination removes groups to form a multiple bond. Hydrolysis breaks a bond through reaction with water; condensation joins species while eliminating a small molecule such as water. Organic oxidation commonly gains oxygen or loses hydrogen; reduction commonly gains hydrogen or loses oxygen, alongside the general electron/oxidation-number definitions from Topic 2.2. The symbols [O] and [H] may represent supplied oxidising and reducing equivalents, but an equation still needs atom balance.",
   "claim_ids": [
    "CLM-8224-4.1-001",
    "CLM-8224-4.1-002",
    "CLM-8224-4.1-003",
    "CLM-8224-4.1-004"
   ],
   "context_tags": [],
   "assessment_objectives": [
    "A",
    "B"
   ],
   "claims_seen": {
    "CLM-8224-4.1-001": 1,
    "CLM-8224-4.1-002": 1,
    "CLM-8224-4.1-003": 1,
    "CLM-8224-4.1-004": 1
   },
   "authored_hash": "444370f2702005c5b238758eaab3684b3a7566ac7c590c54612353c2b4cb5c4a"
  },
  {
   "block_id": "4.1-1-02-b1",
   "block_type": "plain_explanation",
   "heading": "Naming and representing the syllabus families",
   "text": "Choose the appropriate parent chain containing the principal functional group and number it to give that group or required prefix its lowest permitted locant. The one-to-six-carbon stems are meth-, eth-, prop-, but-, pent- and hex-. Alkanes use –ane, alkenes –ene, alcohols –ol, aldehydes –al, ketones –one, carboxylic acids –oic acid and amines –amine. Halogen substituents use fluoro-, chloro-, bromo- or iodo-. An ester has an alkyl name from the alcohol-derived part followed by an alkanoate name from the acid-derived part. Thus CH3COOCH2CH3 is ethyl ethanoate: the two-carbon group attached through oxygen supplies ethyl, while the acid-derived portion supplies ethanoate. Naming requires those connections, not just total carbon count.\n\nExamples include hexane, but-1-ene, 1-chlorobutane, propan-2-ol, butanal, butan-2-one, pentanoic acid, ethyl ethanoate and ethanamine. The carboxyl or aldehyde carbon is part of the parent chain. Use di-, tri-, tetra-, penta- and hexa- for two through six repeated features; mono- means one but is commonly omitted where the naming convention implies it. For example, CH2ClCHClCH3 is 1,2-dichloropropane, not a name obtained by numbering from the end that gives 2,3.\n\nA molecular formula gives actual atom numbers; an empirical formula gives their simplest ratio. Structural condensed notation such as CH3CH2OH shows grouped connections; a displayed representation shows the bonds explicitly; skeletal notation uses line ends and vertices for carbon and omits its attached hydrogens. Molecular, empirical, structural condensed, displayed and skeletal forms therefore answer different requests. Check that carbon has four bond contributions, counting a double bond twice, when moving between representations. Topic 1.1 covers composition ratios, while later organic topics apply the named functional groups.",
   "claim_ids": [
    "CLM-8224-4.1-005",
    "CLM-8224-4.1-006",
    "CLM-8224-4.1-007"
   ],
   "context_tags": [],
   "assessment_objectives": [
    "A",
    "B"
   ],
   "claims_seen": {
    "CLM-8224-4.1-005": 1,
    "CLM-8224-4.1-006": 1,
    "CLM-8224-4.1-007": 1
   },
   "authored_hash": "698908aa9646d36b8cbb92ccd353b4142e96013e8ce404bb2843d32c95b1800a"
  }
 ],
 "word_count": 577,
 "qa_status": "review_required",
 "notes": [
  "Original teaching prose; source-backed claim ledger. Independent semantic review remains required."
 ]
}
