{
  "unit_id": "CU-6136-7.1.01",
  "title": "Density and distribution",
  "objective_ids": [
    "OBJ-6136-7.1.01-00",
    "OBJ-6136-7.1.01-01",
    "OBJ-6136-7.1.01-02"
  ],
  "level": "NSSCO",
  "core_status": "core",
  "objective_type": "integrated_subject_lesson",
  "depth_tier": 3,
  "word_budget": {
    "min": 725,
    "target": 883,
    "max": 1042
  },
  "blocks": [
    {
      "block_id": "BLK-6136-7.1.01-01",
      "block_type": "plain_explanation",
      "heading": "Density and distribution",
      "text": "Population density measures people per unit area; distribution describes where people live and how they are spread. A mean density can conceal concentrations. Density equals population divided by area, using comparable dates and boundaries.",
      "claim_ids": [
        "CLM-6136-7.1-01-00-01",
        "CLM-6136-7.1-01-00-02"
      ],
      "context_tags": [
        "original teaching; fictional examples where stated"
      ],
      "assessment_objectives": [
        "A",
        "B"
      ],
      "claims_seen": {
        "CLM-6136-7.1-01-00-01": 1,
        "CLM-6136-7.1-01-00-02": 1
      },
      "authored_hash": "040fb3fb8ae3613514e10d06368a9c0dfca54a9fa206f4768c5f5e28349ccf3b"
    },
    {
      "block_id": "BLK-6136-7.1.01-02",
      "block_type": "plain_explanation",
      "heading": "Population density",
      "text": "Population density is the number of people per unit area, commonly people per square kilometre. A fictional 12,000 residents over 300 km² gives 12,000 ÷ 300 = 40 people per km²; it does not mean each square kilometre contains 40 people.",
      "claim_ids": [
        "CLM-6136-7.1-01-01-01",
        "CLM-6136-7.1-01-01-02"
      ],
      "context_tags": [
        "original teaching; fictional examples where stated"
      ],
      "assessment_objectives": [
        "A",
        "B"
      ],
      "claims_seen": {
        "CLM-6136-7.1-01-01-01": 1,
        "CLM-6136-7.1-01-01-02": 1
      },
      "authored_hash": "91acfee76ca71098507489d417d8e49f13a04f3f229fffd21f17e8b2b820e39c"
    },
    {
      "block_id": "BLK-6136-7.1.01-03",
      "block_type": "plain_explanation",
      "heading": "Population distribution",
      "text": "Population distribution is the spatial pattern showing where people live and how they are spread across an area. Describe clusters, sparse areas and relationships to locations using map evidence. A number per square kilometre does not describe the full spatial pattern.",
      "claim_ids": [
        "CLM-6136-7.1-01-02-01",
        "CLM-6136-7.1-01-02-02"
      ],
      "context_tags": [
        "original teaching; fictional examples where stated"
      ],
      "assessment_objectives": [
        "A",
        "B"
      ],
      "claims_seen": {
        "CLM-6136-7.1-01-02-01": 1,
        "CLM-6136-7.1-01-02-02": 1
      },
      "authored_hash": "01db38c218a71e3c2e0fd37db12fd2156606cee60163ca5684ef0f4427e76f29"
    },
    {
      "block_id": "BLK-6136-7.1.01-04",
      "block_type": "worked_application",
      "heading": "Apply the measure",
      "text": "Calculate density for a fictional area with 12,000 people and 300 km². Show working. 12,000 ÷ 300 = 40 people per km².",
      "claim_ids": [
        "CLM-6136-7.1-01-00-01",
        "CLM-6136-7.1-01-00-02",
        "CLM-6136-7.1-01-01-01",
        "CLM-6136-7.1-01-01-02",
        "CLM-6136-7.1-01-02-01",
        "CLM-6136-7.1-01-02-02"
      ],
      "context_tags": [
        "original teaching; fictional examples where stated"
      ],
      "assessment_objectives": [
        "A",
        "B"
      ],
      "claims_seen": {
        "CLM-6136-7.1-01-00-01": 1,
        "CLM-6136-7.1-01-00-02": 1,
        "CLM-6136-7.1-01-01-01": 1,
        "CLM-6136-7.1-01-01-02": 1,
        "CLM-6136-7.1-01-02-01": 1,
        "CLM-6136-7.1-01-02-02": 1
      },
      "authored_hash": "ce5197731be7db7e30281f536074433aa26a79b90c751f1d7b6071221aeaf5b9"
    },
    {
      "block_id": "BLK-6136-7.1.01-05",
      "block_type": "cross_link",
      "heading": "Connect the ideas",
      "text": "Connect population evidence to Health (7.2), Education (7.3) and Urbanisation (4.2). Check dates, boundaries, denominators and units before explaining what a pattern supports.",
      "claim_ids": [
        "CLM-6136-7.1-01-00-01",
        "CLM-6136-7.1-01-00-02",
        "CLM-6136-7.1-01-01-01",
        "CLM-6136-7.1-01-01-02",
        "CLM-6136-7.1-01-02-01",
        "CLM-6136-7.1-01-02-02"
      ],
      "context_tags": [
        "original teaching; fictional examples where stated"
      ],
      "assessment_objectives": [
        "A",
        "B"
      ],
      "claims_seen": {
        "CLM-6136-7.1-01-00-01": 1,
        "CLM-6136-7.1-01-00-02": 1,
        "CLM-6136-7.1-01-01-01": 1,
        "CLM-6136-7.1-01-01-02": 1,
        "CLM-6136-7.1-01-02-01": 1,
        "CLM-6136-7.1-01-02-02": 1
      },
      "authored_hash": "b60f6f6b553d1ac14151990a10afad80b17ff39df710acae15949d0c767f19a3"
    }
  ],
  "word_count": 174,
  "qa_status": "review_required",
  "notes": [
    "Approved lower word allocations advisory; no padding of integrated parent/member explanations."
  ]
}
