{
 "unit_id": "CU-8224-3.5.2",
 "title": "Nitrogen and Sulfur — 3.5.2",
 "objective_ids": [
  "OBJ-8224-3.5.2-01",
  "OBJ-8224-3.5.2-02",
  "OBJ-8224-3.5.2-03"
 ],
 "level": "NSSCAS",
 "core_status": "core",
 "objective_type": "integrated_teaching",
 "depth_tier": 1,
 "word_budget": {
  "min": 840,
  "target": 1021,
  "max": 1203
 },
 "blocks": [
  {
   "block_id": "3.5-2-01-b1",
   "block_type": "plain_explanation",
   "heading": "Where sulphur dioxide comes from",
   "text": "Sulphur dioxide is an atmospheric pollutant associated with burning fuels that contain sulphur compounds and with processing sulphide ores. Sulphur in the feed is oxidised during combustion or roasting. The simplified elemental relation is S + O2 → SO2. The sulphur may originally be in a compound, so the fuel is not assumed to contain only free yellow sulphur. Elemental sulphur changes from oxidation number 0 to +4 in SO2, consistent with oxidation and the oxygen consumed in this equation.\n\nCoal and petroleum-derived fuels can contain sulphur-bearing material. If it is oxidised to SO2, increasing the mass of sulphur burned increases the potential gas amount unless capture or another pathway intervenes. Carbon combustion produces carbon oxides, whereas sulphur supplies the sulphur atom of SO2. A fuel's carbon content cannot by itself establish its sulphur dioxide output.\n\nRoasting sulphide ores gives a second source. As the feed is heated in oxygen, sulphur can leave as SO2 while the metal-bearing material changes to a form suitable for further extraction. The precise equation depends on the ore, but the pathway connects to the copper-processing outline in Topic 3.3. Not every ore is a sulphide, so the pollutant cannot be assigned equally to every metal extraction solely from the word mining.\n\nFor original amount arithmetic, 1.00 mol of sulphur atoms can give 1.00 mol SO2 in the simplified complete-oxidation model. Using molar masses 32.0 and 64.0 g mol⁻¹, 32.0 g sulphur corresponds to 64.0 g SO2, with oxygen supplying the extra mass. Actual atmospheric release also depends on combustion and capture. Distinguish pollutant formed from pollutant emitted when interpreting an industrial scenario; neither a fuel label nor a reaction equation replaces an emission measurement.",
   "claim_ids": [
    "CLM-8224-3.5-021",
    "CLM-8224-3.5-022",
    "CLM-8224-3.5-023"
   ],
   "context_tags": [],
   "assessment_objectives": [
    "A",
    "B"
   ],
   "claims_seen": {
    "CLM-8224-3.5-021": 1,
    "CLM-8224-3.5-022": 1,
    "CLM-8224-3.5-023": 1
   },
   "authored_hash": "e12c3ae19e7fc90f6c3b987ebdf96a90232c105c013af5193f53c0c14ea8caec"
  },
  {
   "block_id": "3.5-2-02-b1",
   "block_type": "plain_explanation",
   "heading": "Breathing effects and acid deposition",
   "text": "Sulphur dioxide is relevant to health because exposure can affect breathing. WHO identifies an association between SO2 exposure and asthma-related hospital and emergency visits. This is a reason to control exposure, not a claim that an observed illness in one person can be diagnosed from a nearby chimney. The chemistry resource concerns the pollutant pathway and general consequence rather than individual medical assessment.\n\nSO2 also contributes to acid rain and other acidic deposition. It dissolves and reacts in atmospheric water, and oxidation can produce sulphuric acid. A simplified overall balance is 2SO2 + O2 + 2H2O → 2H2SO4. The real atmosphere contains several reaction pathways, so this net equation does not describe a single collision occurring as written.\n\nAcidic water can change soil and surface-water chemistry and harm susceptible organisms. It also reacts with carbonate building materials such as limestone: CaCO3 + 2H+ → Ca2+ + CO2 + H2O. The material is gradually lost through chemical reaction, not simply stained by a coloured gas. Nitrogen oxides can contribute to acidic deposition as well, so identifying SO2 as a cause does not mean it is the only atmospheric acid precursor.\n\nWhen evaluating a proposed control, identify the target. Reducing SO2 formation or capturing it lowers a precursor to both exposure and acid deposition. Filtering dust alone does not establish that SO2 has been removed, and a measured stack concentration does not directly equal the concentration inhaled by a population after dispersion. A complete explanation connects the source, gas transport or chemical transformation, and the named effect. No numerical exposure threshold is needed to recall the syllabus's breathing and acid-rain consequences.",
   "claim_ids": [
    "CLM-8224-3.5-024",
    "CLM-8224-3.5-025",
    "CLM-8224-3.5-026"
   ],
   "context_tags": [],
   "assessment_objectives": [
    "A",
    "B"
   ],
   "claims_seen": {
    "CLM-8224-3.5-024": 1,
    "CLM-8224-3.5-025": 1,
    "CLM-8224-3.5-026": 1
   },
   "authored_hash": "09fa98a4ec4e1dab22f2e015eee0035d3597d03b16ee8226c705611c2da904da"
  },
  {
   "block_id": "3.5-2-03-b1",
   "block_type": "plain_explanation",
   "heading": "Low-sulphur fuels and interpreting a guideline",
   "text": "Using a lower-sulphur fuel reduces the sulphur available to form SO2 in a comparable combustion process. This is a source-control approach. Gas treatment can provide an additional control after formation. The relevance to vehicles and power generation follows the same atom balance: less sulphur feed generally means less potential sulphur dioxide, while the actual emitted amount also depends on capture and operation.\n\nFor an original comparison, two equal 1000 kg fuel batches containing 1.00% and 0.200% sulphur supply 10.0 kg and 2.00 kg sulphur respectively. Under the simplified complete-conversion model they could form 20.0 kg and 4.00 kg SO2. These are potential formation masses, not measured emissions. The example shows how changing fuel composition can reduce a pollutant source without assigning any current value to a named station.\n\nThe syllabus refers to WHO limits in this context. WHO's air-quality guidelines are health-based recommendations for pollutant concentrations over specified exposure averaging periods. They can inform national standards, but do not themselves establish a particular plant's legal emission permit. Keep ambient exposure, stack emissions and legal compliance distinct. This clarification follows the [official WHO explanation](https://www.who.int/news-room/questions-and-answers/item/who-global-air-quality-guidelines).\n\nVan Eck at Windhoek is the syllabus's named power-station context. A question can use it to ask why low-sulphur fuel helps reduce SO2. A claim that the station currently meets or exceeds a requirement would instead need current relevant measurements, averaging basis and the applicable requirement. No such compliance claim is made from the chemical equation. State the control's purpose and the evidence required to assess it, preserving the syllabus lesson while keeping the meaning of a guideline precise.",
   "claim_ids": [
    "CLM-8224-3.5-027",
    "CLM-8224-3.5-028",
    "CLM-8224-3.5-029"
   ],
   "context_tags": [],
   "assessment_objectives": [
    "A",
    "B"
   ],
   "claims_seen": {
    "CLM-8224-3.5-027": 1,
    "CLM-8224-3.5-028": 1,
    "CLM-8224-3.5-029": 1
   },
   "authored_hash": "82d808b9a0ef4944d42f4afbaf61f289d339581bad923fcbdb47aa348f00a067"
  }
 ],
 "word_count": 845,
 "qa_status": "review_required",
 "notes": [
  "Original teaching prose; source-backed claim ledger. Independent semantic review remains required."
 ]
}
